{
  "monte_carlo": {
    "openloop-sequential": {
      "avg_reward": {
        "mean": 0.19593650000000004,
        "ci95": 0.0025116932268532386
      },
      "total_reward": {
        "mean": 587.8095,
        "ci95": 7.5350796805597176
      },
      "intercept_ratio": {
        "mean": 0.8938000000000001,
        "ci95": 0.006026824833014411
      },
      "threat_intercept_ratio": {
        "mean": 0.77875,
        "ci95": 0.012555885068780026
      },
      "intercept_rate": {
        "mean": 0.44813166666666665,
        "ci95": 0.0051037785403923105
      },
      "false_alarm_rate": {
        "mean": 0.000125,
        "ci95": 2.945102588603341e-05
      },
      "mean_time_to_first_intercept": {
        "mean": 96.46949378411442,
        "ci95": 5.758199970229658
      },
      "threat_mean_ttff": {
        "mean": 205.40523124098124,
        "ci95": 13.481250716270473
      },
      "pct_correct_predictions": {
        "mean": 0.45802708333333336,
        "ci95": 0.006279852032309662
      },
      "avg_intercept_time_error": {
        "mean": 50.43583372835373,
        "ci95": 5.222324131437392
      },
      "n_periodic_locked": {
        "mean": 3.735,
        "ci95": 0.1646769891447158
      }
    },
    "openloop-random": {
      "avg_reward": {
        "mean": 0.19689295,
        "ci95": 0.0026518332931873122
      },
      "total_reward": {
        "mean": 590.67885,
        "ci95": 7.955499879561935
      },
      "intercept_ratio": {
        "mean": 0.9890000000000001,
        "ci95": 0.0027753386320615134
      },
      "threat_intercept_ratio": {
        "mean": 0.9770833333333333,
        "ci95": 0.005781955483461484
      },
      "intercept_rate": {
        "mean": 0.4484916666666667,
        "ci95": 0.00508616217166892
      },
      "false_alarm_rate": {
        "mean": 0.00010999999999999999,
        "ci95": 2.744250128186657e-05
      },
      "mean_time_to_first_intercept": {
        "mean": 180.28873260869565,
        "ci95": 8.448965488099528
      },
      "threat_mean_ttff": {
        "mean": 347.7828257575758,
        "ci95": 17.62204201232298
      },
      "pct_correct_predictions": {
        "mean": 0.45782708333333333,
        "ci95": 0.006395990335894006
      },
      "avg_intercept_time_error": {
        "mean": 34.03513928121363,
        "ci95": 2.5912725546536435
      },
      "n_periodic_locked": {
        "mean": 5.645,
        "ci95": 0.134634557675966
      }
    },
    "openloop-priority": {
      "avg_reward": {
        "mean": 0.19644183333333337,
        "ci95": 0.0025623816568578687
      },
      "total_reward": {
        "mean": 589.3255,
        "ci95": 7.687144970573606
      },
      "intercept_ratio": {
        "mean": 0.897,
        "ci95": 0.006073791461152403
      },
      "threat_intercept_ratio": {
        "mean": 0.7854166666666665,
        "ci95": 0.01265373221073417
      },
      "intercept_rate": {
        "mean": 0.4479316666666666,
        "ci95": 0.0050417514795396785
      },
      "false_alarm_rate": {
        "mean": 9.166666666666667e-05,
        "ci95": 2.6173315311480757e-05
      },
      "mean_time_to_first_intercept": {
        "mean": 93.5796808723885,
        "ci95": 5.811471797750947
      },
      "threat_mean_ttff": {
        "mean": 197.88477417027417,
        "ci95": 13.754735643523802
      },
      "pct_correct_predictions": {
        "mean": 0.4580666666666666,
        "ci95": 0.006332931268688801
      },
      "avg_intercept_time_error": {
        "mean": 45.67871035506297,
        "ci95": 4.168620599054024
      },
      "n_periodic_locked": {
        "mean": 3.81,
        "ci95": 0.17430831345837614
      }
    },
    "bandit-ucb": {
      "avg_reward": {
        "mean": 0.9419854000000001,
        "ci95": 0.0049666023265896135
      },
      "total_reward": {
        "mean": 2825.9562,
        "ci95": 14.899806979768845
      },
      "intercept_ratio": {
        "mean": 0.7575999999999999,
        "ci95": 0.008868554460060291
      },
      "threat_intercept_ratio": {
        "mean": 0.5404166666666668,
        "ci95": 0.014961573290301044
      },
      "intercept_rate": {
        "mean": 0.9493666666666667,
        "ci95": 0.004443236341444111
      },
      "false_alarm_rate": {
        "mean": 3.3333333333333333e-06,
        "ci95": 4.608142236777405e-06
      },
      "mean_time_to_first_intercept": {
        "mean": 140.05428537444033,
        "ci95": 9.376230111398014
      },
      "threat_mean_ttff": {
        "mean": 172.94936111111113,
        "ci95": 19.61819236214834
      },
      "pct_correct_predictions": {
        "mean": 0.9949250000000001,
        "ci95": 0.00024105313328253363
      },
      "avg_intercept_time_error": {
        "mean": 57.712387944600174,
        "ci95": 12.030712286008585
      },
      "n_periodic_locked": {
        "mean": 1.085,
        "ci95": 0.14289801050761755
      }
    },
    "rl-linear-q": {
      "avg_reward": {
        "mean": 0.47381458333333343,
        "ci95": 0.025216315370017662
      },
      "total_reward": {
        "mean": 1421.44375,
        "ci95": 75.64894611005298
      },
      "intercept_ratio": {
        "mean": 0.9501999999999999,
        "ci95": 0.005842056470027908
      },
      "threat_intercept_ratio": {
        "mean": 0.89625,
        "ci95": 0.01217095097922481
      },
      "intercept_rate": {
        "mean": 0.7269116666666667,
        "ci95": 0.010285340853637805
      },
      "false_alarm_rate": {
        "mean": 5.8333333333333326e-05,
        "ci95": 1.8776998057678656e-05
      },
      "mean_time_to_first_intercept": {
        "mean": 272.59851953227934,
        "ci95": 12.699534194176534
      },
      "threat_mean_ttff": {
        "mean": 495.6778385642135,
        "ci95": 26.631057251140252
      },
      "pct_correct_predictions": {
        "mean": 0.19165,
        "ci95": 0.00896340725058958
      },
      "avg_intercept_time_error": {
        "mean": 36.66235014165347,
        "ci95": 3.777073124859341
      },
      "n_periodic_locked": {
        "mean": 3.285,
        "ci95": 0.23056520066739036
      }
    },
    "rl-dqn": {
      "avg_reward": {
        "mean": 0.2694345166666667,
        "ci95": 0.021429083733307566
      },
      "total_reward": {
        "mean": 808.30355,
        "ci95": 64.28725119992268
      },
      "intercept_ratio": {
        "mean": 0.9498000000000001,
        "ci95": 0.005694806915870388
      },
      "threat_intercept_ratio": {
        "mean": 0.8954166666666665,
        "ci95": 0.011864181074729979
      },
      "intercept_rate": {
        "mean": 0.5188816666666667,
        "ci95": 0.021696772091605337
      },
      "false_alarm_rate": {
        "mean": 9.666666666666667e-05,
        "ci95": 2.388182145206328e-05
      },
      "mean_time_to_first_intercept": {
        "mean": 292.0874602955016,
        "ci95": 13.449745440492467
      },
      "threat_mean_ttff": {
        "mean": 545.8421675685427,
        "ci95": 27.256205128291313
      },
      "pct_correct_predictions": {
        "mean": 0.37980833333333336,
        "ci95": 0.024770366441676663
      },
      "avg_intercept_time_error": {
        "mean": 43.741279595860206,
        "ci95": 5.301986029502083
      },
      "n_periodic_locked": {
        "mean": 2.845,
        "ci95": 0.20234725065897538
      }
    },
    "smart-scan": {
      "avg_reward": {
        "mean": 0.4168796,
        "ci95": 0.004720971596668887
      },
      "total_reward": {
        "mean": 1250.6388,
        "ci95": 14.162914790006662
      },
      "intercept_ratio": {
        "mean": 0.9758000000000001,
        "ci95": 0.004080128444130529
      },
      "threat_intercept_ratio": {
        "mean": 0.9495833333333331,
        "ci95": 0.008500267591938605
      },
      "intercept_rate": {
        "mean": 0.629275,
        "ci95": 0.004228168987733704
      },
      "false_alarm_rate": {
        "mean": 7.166666666666667e-05,
        "ci95": 2.1161552422948327e-05
      },
      "mean_time_to_first_intercept": {
        "mean": 201.170134057971,
        "ci95": 9.671676836644503
      },
      "threat_mean_ttff": {
        "mean": 410.0740176767677,
        "ci95": 20.359222035737332
      },
      "pct_correct_predictions": {
        "mean": 0.6199854166666667,
        "ci95": 0.012443134698377415
      },
      "avg_intercept_time_error": {
        "mean": 39.43246170419975,
        "ci95": 3.5604659155574088
      },
      "n_periodic_locked": {
        "mean": 4.35,
        "ci95": 0.1923965231249067
      }
    }
  },
  "significance": [
    {
      "comparator": "openloop-sequential",
      "mean_diff": 0.2209431,
      "ci95_low": 0.21652388749999998,
      "ci95_high": 0.22531047583333336,
      "p_value": 0.0,
      "n": 200,
      "significant": true,
      "metric": "avg_reward"
    },
    {
      "comparator": "openloop-random",
      "mean_diff": 0.21998665000000003,
      "ci95_low": 0.21538688958333335,
      "ci95_high": 0.2245515441666667,
      "p_value": 0.0,
      "n": 200,
      "significant": true,
      "metric": "avg_reward"
    },
    {
      "comparator": "openloop-priority",
      "mean_diff": 0.2204377666666667,
      "ci95_low": 0.21579012583333337,
      "ci95_high": 0.22508908541666667,
      "p_value": 0.0,
      "n": 200,
      "significant": true,
      "metric": "avg_reward"
    },
    {
      "comparator": "bandit-ucb",
      "mean_diff": -0.5251058,
      "ci95_low": -0.5306001850000001,
      "ci95_high": -0.51965067625,
      "p_value": 1.0,
      "n": 200,
      "significant": false,
      "metric": "avg_reward"
    },
    {
      "comparator": "rl-linear-q",
      "mean_diff": -0.05693498333333333,
      "ci95_low": -0.08214121208333335,
      "ci95_high": -0.03256486625,
      "p_value": 1.0,
      "n": 200,
      "significant": false,
      "metric": "avg_reward"
    },
    {
      "comparator": "rl-dqn",
      "mean_diff": 0.14744508333333337,
      "ci95_low": 0.12567055708333336,